"task_id","task_name","primary_skill","secondary_skills","complexity_level","estimated_hours","required_experience","productivity_factor","adjusted_hours","team_size","dependencies","critical_path","risk_factors","mitigation_strategy"
"TASK-INF-001","Design and Provision Azure Networking (VNet)","Terraform","Azure Networking,Security","Medium","5.2","Senior","1.1","5.72","1","None","true","Azure Subscription Quota limits","Pre-provision quotas; Modularize Terraform state"
"TASK-INF-002","Provision AKS Cluster with RBAC and CNI","Kubernetes","Terraform,Azure AD","High","10.3","Senior","1.2","13.4","1","TASK-INF-001","true","RBAC integration complexity","Use standard Azure CNI overlay; Test RBAC early"
"TASK-MOB-001","React Native MSAL Configuration & Linking","React Native","iOS,Android,OAuth","High","8.7","Senior","1","11.3","1","US-SEC-001","true","Native linking errors; B2C Custom Policy mismatch","Create PoC app first; Use pre-configured B2C tenant"
"TASK-MOB-002","Implement Mobile Auth Provider & Login Flow","React Native","State Management,Security","Medium","16","Mid","1","19.2","1","TASK-MOB-001","true","Token refresh logic failure","Implement robust error interceptors; Backend Architect review"
"TASK-SERV-005","Implement Background Location Service","React Native","Native Modules,Battery Optimization","High","16","Senior","0.9","20.8","1","TASK-SERV-004","","OS killing background processes; Battery drain","Use foreground service notifications; Test on physical devices immediately"
"TASK-SERV-009","Implement Synchronization Logic (Pull)","React Native","WatermelonDB,Offline-First","High","10.3","Senior","0.9","13.4","1","TASK-SERV-008","","Sync conflicts; Large payload handling","Implement last-write-wins; Batch sync payloads"